{
  "formVersion": "2.0",
  "subjectId": 8,
  "visitType": "Dosing Visit 1",
  "scheduledDate": "2026-05-25",
  "vitals": {
    "heartRate": 67,
    "bloodPressure": "108/75",
    "temperatureC": 36.7,
    "weightKg": 63.6
  },
  "concomitantMeds": [
    {
      "name": "Ondansetron",
      "dose": "4 mg",
      "indication": "Nausea"
    }
  ],
  "investigatorComment": "AE reported: Nausea (Mild)."
}